prefecture,site,site_url,intro
北海道,サツッター,http://satsutter.com/,札幌市民が現地のリアルな情報をお届けします
北海道,IN & OUT ハコダテとヒト,http://www.inandout-hakodate.com/,人々のリアルな声から街の姿を掘り起こす」をテーマに配信中
北海道,クスろ港,http://kusuro.com/,くしろにもっとユーモアを！
北海道,くしろはてな,http://kushirohatena.com/,くしろの世界に負けない魅力をお伝えします
北海道,トカアーズ,https://tokacheers.com/,北海道・十勝が気になる人、暮らす人、みんなを応援するサイト
北海道,十勝Z団,http://www.tokachi-zaidan.jp/tz_detail.php?id=11,ビジネスの地平を切り開くフロンティア開拓団
北海道,夕張新聞,https://yubari-news.jp/,夕張に住む人々の日常をお届けします
北海道,JP01,https://jp01.jp/,日本地域情報コンテンツ大賞受賞！
北海道,キタゴエ,https://kitagoe.jp/,北海道のIT業界を紹介します
北海道,トカニッチ,https://tknc.jp/index.php,知る人ぞ知るニッチな情報をお届け
北海道,asatan,https://asatan.com/,旭川のお得な情報を紹介
青森県,青森日和,https://aomoribiyori.com/,このサイトを見れば青森にいきたくなる！
青森県,TOHOKU360,https://tohoku360.com/,東北の今をお伝えします
青森県,HIROMAGA,https://www.hiromaga.com/,弘前大学の魅力をお伝えします
青森県,まるごと青森,https://www.marugotoaomori.jp/,青森県の魅力をまるごとお伝えします
岩手県,奥州ライフ,http://oshulife.com/,みんなで楽しい街にしよう！
岩手県,はちまんたい通信,https://www.8mt-2shin.com/,岩手県八幡平市 移住・定住情報サイト
岩手県,まきまき花巻,http://makimaki-hanamaki.com/,市民ライターが花巻市の魅力を発信！
岩手県,盛岡さんぽ,http://moriokasanpo.net/,盛岡の食べる、歩く、集めるをお伝えします
岩手県,YOiWA,https://yoiwa.net/,岩手のお酒を楽しむサイト
宮城県,イートマップ仙台,https://eatmap-sendai.com/,仙台の「食」ならこのサイト！
宮城県,KURASHITO,https://kurashito.co.jp/,仙台の物件探しサイト
宮城県,暮らす仙台,https://www.siip.city.sendai.jp/kurasusendai/#1,仙台の素敵な雑貨・食品を紹介
宮城県,SENDAI INC.,https://sendai-inc.com/,仙台のIT就職に関する情報を発信中
宮城県,仙台つーしん,https://sendai-tushin.jp/,仙台の情報を毎日発信中！
宮城県,仙台プレス,http://sendaipress.com/,地元住民にしかわからない、仙台の魅力をお届けします
宮城県,SENDAIマチプラ,http://matipura.com/,宮城仙台がもっと好きになる散策マガジン
秋田県,あきたナビ,https://akita-navi.net/,秋田のイベントやグルメ情報、体験したことを発信中
秋田県,あきたライフろぐ,https://kitaakita-life.com/,秋田県北部の暮らしを発信中
秋田県,WE LOVE AKITA MAGAZINE,http://we-love-akita.com/magazine/,あきたの情報を東京から発信するWEBメディア
秋田県,UGONEWS,https://ugonews.jp/,まちの「いいね！」がみつかる住民参加型ニュースサイト
秋田県,CLOCKNOTE,https://clocknote.jp/,これからの秋田を旅するブログメディア
山形県,おきたま新聞,kitamaok.com,山形置賜の粋な情報を発信するWEBマガジン
山形県,家族４人、山形暮らしはじめました。,https://www.itohidekazu.com/,
山形県,CLIP山形,https://yamagata-clip.com/,山形の美しい自然をお届け
山形県,FLOAT SHONAI,https://float-shonai.com/,庄内を思いっきり楽しむWebメディア
山形県,Bonjour SHONAI,https://bonjourshonai.work/,ブログで旅する庄内エリア
山形県,meets8,https://meets8.jp/,おきたまのおもしゃいを届けるＷＥＢマガジン
山形県,real local山形,https://www.reallocal.jp/yamagata,山形のリアルをお伝えします
福島県,いごく,https://igoku.jp/,いわきの「いごき」をお伝えするウェブマガジン
福島県,こおりやま通信,http://koriyama2shin.com/,郡山市民にしかわからない情報を発信中
福島県,100年ふくしま,http://100nenfukushima.jp/,福島をシンプルにお伝え
福島県,福島TRIP,https://www.fukushimatrip.com/,ガイドブックに載らない福島の旅が見つかる
茨城県,いばらじお,https://www.ibarakindp.com/,茨城の魅力を普通のおじさんがアピール
茨城県,つくばスタイル,https://www.tsukuba-style.jp/index.html,茨城県内つくばエクスプレス沿線のライフスタイル情報マガジン
茨城県,TRIX MAG.,http://trix-mag.com/,水戸の今がわかるウェブマガジン
茨城県,NEWSつくば,https://newstsukuba.jp/,つくばの伝統・科学をお伝えします
茨城県,Hokotta!,https://hokotta.jp/,みんなで作る鉾田キュレーションマガジン
栃木県,イシロー！,https://news.gotouti.jp/%e3%82%a4%e3%82%b7%e3%83%ad%e3%83%bc%ef%bc%81/,石橋を知ろう！楽しもう！しもつけ・石橋ローカルWEBメディア
栃木県,うつのみや通信,http://utsunomiya2shin.com/,市民目線で雑談ネタをは発信中
栃木県,NASUMO,https://nasumo.jp/,あなたの知りたい那須がある
栃木県,haletto,https://woman.chintai/article/,女性の一人暮らしを応援する賃貸物件サイト
栃木県,YaitaSaita,http://yaita-saita.net/,栃木県全域の情報をシンプルにお伝えします
群馬県,あずまある,https://azuma-ru.com/,前橋東地区応援メディア
群馬県,いまここ,http://imakoko-gunma.com/,群馬のいま、ここを伝えるローカルメディア
群馬県,gooma,http://gooma.jp/,大切なことを残して伝える
群馬県,We love群馬,https://we-love.gunma.jp/,群馬の情報サイト
群馬県,さいくら,https://saikura.info/,埼北に住む人と住みたい人のためのローカルメディア
群馬県,高崎で暮らす,https://takasaki-life.com/,あなただけの“高崎”を発見するWEBサイト
群馬県,館林くらし,https://tatebayashi.info/,館林市とその周辺地域のローカル情報サイト 群馬県情報も少し
群馬県,つぐひ,https://www.tsuguhi.jp/,いつもの群馬を見つける、伝える
埼玉県,itacco,http://itacco.net/,東京北部＆埼玉南西部エリアの【子育て・グルメ・イベント】の地域情報
埼玉県,浦和裏日記(さいたま市の地域ブログ),https://saitama-omiya-urawa.blog.jp/,大宮、浦和、さいたま新都心情報を地元OLがお届けします。
埼玉県,Urawacity.net,https://urawacity.net/,浦和の地域メディア
埼玉県,URAWA-MISONO.net,https://www.urawa-misono.net/,浦和美園・東川口 周辺の地域情報ページ
埼玉県,うろうろ越谷,https://koshigaya-laketown.work/,
埼玉県,大宮経済新聞,https://omiya.keizai.biz/,
埼玉県,カワグチマニア,https://kawaguchi-mania.com/,川口市で暮らす、遊ぶ、働く人へ役に立つかもしれない情報をお届けします
埼玉県,カワゴエ・マス・メディア,https://koedo.info/,街の活性化に取り組む皆を応援しています。
埼玉県,川越UNIV,https://kawagoeuinv.com/,観光スポットからまちづくりや政策まで、川越の”森羅万象”を綴るブログです
埼玉県,川越をわたる,https://kawagoe-matinami.com/,地元民が知る小江戸川越について語ろう
千葉県,市川にゅ～す,https://ichi-24.jp/,千葉県市川市のローカルネタをお届け中！
千葉県,Ichikawa Life Style,https://ichikawalife.com/,市川市の情報満載WEBマガジン
千葉県,印西とぴっく,https://www.inzai-topic.com/,実際に印西市に住む管理人が集めたイベント・ニュース・グルメなどの地域情報を日々お届けしています。
千葉県,浦安に住みたい！web,https://sumitai.ne.jp/urayasu/,浦安のことがもっと好きになる、知りたくなる
千葉県,浦安ままらいふ,https://urayasumama.com/,浦安在住のママが地域の情報をお届けします
千葉県,柏つうしん,https://kashiwa-tsushin.com/,千葉県柏市のローカルでマニアックなニュース・グルメ・イベント・お店の開店閉店情報といった地元ネタを扱う、地域情報ブログ！
東京都,Akiba.TV,https://akiba.tv/,ディープなアキバをお伝えします
東京都,ACT LOCALLY,http://www.act-locally.com/,僕らが住む代々木上原を見つめ・考え・行動する。 代々木上原のメディア。
東京都,荒川102,https://arakawa102.com/,荒川区のゆる系ローカルマガジン
東京都,イケブクログ,https://ikebukulog.tokyo/,池袋の話題を中心に多彩な情報をお届けします！
東京都,itacco,http://itacco.net/,コドモも オトナも “暮らす” を楽しむ
東京都,いたばしTIMES,https://itabashi-times.com/,板橋区の地域情報、面白ネタなど板橋に関わりない人にはさっぱり面白くない情報を発信していくサイトです
東京都,吉祥寺つーしん,https://majikichi.tokyo/,マジで吉祥寺を愛してる
東京都,京橋タイムズ,https://www.kyobashi.tokyo/,京橋をもっと楽しむための情報サイト
東京都,新宿マガジン,https://shinjukumagazine.com/,新宿がいつもより楽しくなる情報マガジン
東京都,杉並Times,https://suginamitimes.tokyo/,鈴並のリアルな暮らしをお届け
東京都,世田谷ローカル,https://komuken.com/,世田谷に関する情報を毎日更新でお届け
東京都,調布ガイド,https://chofuguide.com/,調布で遊ぶ・食べる・楽しむをお届けする地域メディア
東京都,TOweb,http://tomagazine.jp/,【 ハイパーローカルな東京カルチャーガイド 】
東京都,ナカメディア,https://nakamedia.jp/,中目黒の情報だけに特化した、ローカルwebサイト
東京都,futakoloco,https://futakoloco.com/,二子玉川まちメディア
東京都,machikochi,https://machikochi.jp/,働く女性に、池袋の街に、笑顔のバトンをつなごう
神奈川県,厚木らぼ,https://atsugi-lab.com/,海老名もいいけど厚木もね！
神奈川県,UMIROGI,http://shonan-ijyu.life/,海の近くでくつろぎながら、みんなのハッピーをシェアできる 湘南 WEB マガジン
神奈川県,エキウミ,https://www.ekiumi.com/,茅ヶ崎市民の暮らし方・働き方・遊び方が満載。
神奈川県,エビジョイ,https://ebijoy.jp/,もっと海老名をたのしみ、もっとたのしい海老名に。
神奈川県,おとなりさん,https://otonarisan.info/,小田原、回覧板系フリーマガジン
神奈川県,くらす湘南,http://class-shonan.com/,藤沢市在住の管理人が、グルメやイベント、子育て、遊び場など生の情報をお届け。
神奈川県,THE SHONAN MAG,http://shonan-magazine.jp/,湘南の今を感じるWeb Magazine.
神奈川県,JIMOHACK湘南,https://jimohack-shonan.jp/,湘南エリア（茅ヶ崎・藤沢・平塚等）の観光・暮らし・グルメ情報マガジン
神奈川県,Bunten,https://bun-ten.com/,子どもとお出かけ、旅と鉄道
神奈川県,森ノオト,http://morinooto.jp/,地域で見つけるエコの種
神奈川県,ロクジノヘダタリ,https://www.6zi.jp/,神奈川県で暮らす・働く・遊ぶ
新潟県,Komachi Web,https://www.week.co.jp/,今日にいいこと。週末に楽しいこと。
新潟県,さどトリコ,https://www.sadotrico.jp/,記事一覧あそぶとまるたべるふねよりも新聞
新潟県,上越ことり組,https://joetsuktr.com/,上越市の子育て世代のウェブマガジン
新潟県,Things,https://things-niigata.jp/,NIIGATA LOCAL WEB MAGAZINE
新潟県,にいがたレポ,https://niigata-repo.com/,新潟の暮らし発見マガジン
山梨県,こ、こすげぇー,https://ko-kosuge.jp/,小菅村を楽しむための総合情報サイト
山梨県,ふじのーと,https://www.yamanashibank.co.jp/fuji_note/,山梨がもっと好きになる
長野県,いいいいいいづな,https://iizuna.jp/,知る人ぞ知る飯綱町の魅力、最新情報など、飯綱町の「いい！」ところを発信します
長野県,しあわせ信州,https://blog.nagano-ken.jp/,みんなでシェアして信州がもっと好きになる
長野県,Skima信州,https://skima-shinshu.com/,信州の隙間を「好き」で埋める
長野県,ハジメマシテ、飯田,https://i-port.biz/,「ハジメル」を応援する、企業情報支援メディア
長野県,ハチモット,http://8mot.com/,八ヶ岳をもっと楽しむためのWEBメディア
長野県,ヤミツキマツモト,https://yami2ki.com/,youtube、ヤマモトミツキチャンネルが今熱い！
長野県,Ringos,https://news.gotouti.jp/ringos/,みんなで作る、松本市NEOマガジン
岐阜県,かかみがはら暮らし委員会,https://kakamigaharakurashi.com/,かかみがはらの暮らしをお届けします
岐阜県,ガキろぐ！,https://gakirog.com/, ３０年間過ごした大垣市のグルメや観光スポット・レジャーなど地元ならではの目線で紹介
岐阜県,さかだちブックス,https://sakadachibooks.com/,岐阜の情報を毎日配信中
岐阜県,東海最前線,https://tokai-saizensen.jp/,東海地方発、世の中にインパクトを与える企業・団体・個人の最前線の情報を届けます。
岐阜県,なかつが話,https://nakatsuga-wa.com/,中津川を面白くする大人たち
岐阜県,NAGOYA.,https://nagoyadot.jp/,ナゴヤの今がどっと詰まったウェブメディア
岐阜県,HIROBA!,http://hiroba-magazine.com/,東海エリアの魅力発掘ウェブマガジン
岐阜県,Life Designs,https://life-designs.jp/,東海の暮らしをもっと楽しく
静岡県,伊豆ログ,https://oyamax.com/,伊豆暮らしの“ワクワク”を集めた地域Webマガジン
静岡県,オンモプラス,https://plus.on-mo.jp/,浜松地域の子育てママ向けスマホメディア
静岡県,On Ridgeline,https://on-ridgeline.com/,静岡県東部〜富士五湖エリアの文化をつなぐローカルメディア
静岡県,静岡商工データ,http://www.shoko-data.co.jp/,倒産・解散合併・新設法人・入札落札・求職者情報
静岡県,静岡のすゝめ,https://www.gogo-shizuoka.jp/,元ライターがおすすめする「静岡県の魅力たっぷり」Webマガジン
静岡県,ド・コ・ダ,https://docoda.town/,藤枝にある、ヒト・コト・モノ
静岡県,ぶらり浜松,https://burahama.com/,浜松市を中心に静岡県西部エリアのちょっと気になる情報を発信するローカルメディア
静岡県,ほしの便り,https://hoshi.localinfo.jp/,魅力的な「まち」を作るのは、魅力的な「人」。
静岡県,みちくさらいふ,https://ohara-ocuret.com/,毎日がいつもより少しだけ楽しくなる情報を発信中
静岡県,miteco.,http://estlinks.co.jp/miteco/,みてきてつながる、しぞ～かネット
静岡県,南伊豆新聞,http://minamiizu.news/,南伊豆新聞は南伊豆の粋な情報を発信するWEBマガジン
静岡県,LODGE MONDO -聞土-,https://lodge-mondo.com/,「半島」の中で育まれた独自の文化と生活。そんな伊豆の遊びや楽しい事を情報発信
愛知県,IDENTITY名古屋,https://nagoya.identity.city/,名古屋全体の情報をお届け
愛知県,犬山さんぽ,https://inuyamasannpo.com/,"犬山の魅力を発信する地域WEBマガジン
"
愛知県,縁側,https://engawa-toyota.com/,とよたでつながるローカルメディア
愛知県,ぐるぐる名古屋,https://guruguru.nagoya/,名古屋駅エリアに特化した情報サイト
愛知県,江南しえなん,http://konanjoho.com/,江南市の地域情報サイト！
愛知県,栄ミナミWeb,https://www.sakaeminami.jp/,栄ミナミをとことん楽しむサイト
愛知県,Snap! magazine,https://snamag.com/,その街のファッションとカルチャーを伝えるWeb Site
愛知県,大ナゴヤノート,https://note.dai-nagoya.jp/,まちを見つめて、書きとめて
愛知県,とよはしMAP,https://toyohashi-map.com/,愛知県豊橋市周辺の情報をお届けしています
愛知県,名古屋情報通,https://jouhou.nagoya/,名古屋の魅力と旬な話題を発信するウェブサイト
三重県,伊賀タウン情報YOU,https://www.iga-younet.co.jp/,"三重 伊賀地域の""今""を配信するウェブサイト"
三重県,いがりんく,https://iga-link.com/,旅行情報・伊賀の情報をお届け
三重県,OTONAMIE,https://otonamie.jp/,じわじわきてます、じわっと
三重県,HANZOU,https://hanzou-magazine.net/,三重県で唯一関西か東海かわからない、伊賀市・名張市のWebマガジン
三重県,HIROBA!,http://hiroba-magazine.com/,東海エリアの魅力発掘ウェブマガジン
三重県,松阪市つーしん,https://matsusaka-2shin.com/,松坂に関する情報を発信
三重県,Life Designs,https://life-designs.jp/,東海の暮らしをもっと楽しく
富山県,だって富山人だもの,https://arnon.jp/,富山の噛めば噛むほど味の出る昆布のような魅力をお伝えします
富山県,富山の遊び場！,https://toyama-asbb.com/,富山をおもしろくするをモットーに情報を発信中！
富山県,日刊オンラインタクト,https://takt-toyama.net/,毎日更新！富山県のおすすめグルメ、楽しいイベント情報が満載。
石川県,加賀ぐらし,https://kagagurashi.com/,加賀の暮らしを楽しもう
石川県,金沢時間,https://kanazawatime.net/,金沢に生きるを楽しむウェブマガジン
石川県,金沢まちゲーション,https://kanazawamachigation.com/,北陸の建物や街の開発を追っていく地域密着サイト
石川県,週末、金沢。,https://www.weekend-kanazawa.com/,地元で過ごす週末がより豊かで、より彩りあるものになるように。
石川県,すっとずっと,https://sutto-zutto.com/,「珠洲に行くと、心がなんだかスッとするんだ。」
石川県,BONNO,https://news.gotouti.jp/bonno/,煩悩バンザイ！石川県がもっと楽しくなるウェブマガジン「ボンノ」
福井県,いけだごのみ,https://ikedagonomi30.jimdofree.com/,訪れるたび、好きになる。福井県池田町情報サイト
福井県,Dearふくい,https://dearfukui.jp/,福井県を楽しむ全ての方に…
福井県,日々URALA,https://urala.today/,福井の今を毎日配信中
福井県,ふーぽ,https://fupo.jp/,毎日発信！ふくいの旬な街ネタ&おでかけ情報ポータル
福井県,フクブロ,https://fukublo.jp/,福井人がおススメを紹介！
福井県,real local福井,https://www.reallocal.jp/fukui,福井のリアルをお伝えします
滋賀県,草津だけ。,https://kusatsudake.com/,滋賀県草津市（草津駅・南草津駅周辺など）の旬な情報を発信します。
滋賀県,こめつぶ,http://cometubu.com/,おもわず米原に来てしまう、ウェブマガジン
滋賀県,しがジン,https://shigajin.com/,滋賀の情報をママ目線で発信します
滋賀県,滋賀つーしん,https://shiga2.jp/,滋賀県全域の情報をお伝えします
滋賀県,しがトコ,https://shigatoco.com/,滋賀のええとこ
京都府,ALCO 宇治・城陽,https://alco-uj.com/,山城地域の情報サイト
京都府,icoico,https://icoico.jp/,関西の今を楽しく、おいしく、遊びつくすためのwebニュースマガジ
京都府,宇治の方程式,https://uji-news.com/,地域の人と人をつなげるローカルマガジン
京都府,関西散歩ブログ,https://kansai-sanpo.com/,大阪・関西の都市開発をフィールド調査
京都府,キタキタ！,https://kitakita.otani.ac.jp/,キタ区キタ大路発のリトルプレス
京都府,京トーク,https://kyo-talk.jp/,京都好きによる、京都好きのための、京都メディア
京都府,KYOTO CRAFTS MAGAZINE,https://www.kougeimagazine.com/,ものづくりの奥深さや面白さを探り語り合い伝える
京都府,KYOTO SIDE,https://www.kyotoside.jp/,あなたの「いいね」で「和」を世界へ
京都府,京都速報,https://kyo-soku.com/,京都がもうちょい面白くなるウェブマガジン
大阪府,あべの天王寺なう！,https://abeten.info/,あべてんなう阿倍野・天王寺を、もっと楽しもう！
大阪府,アラウンド・藤白台,https://ara-fuji.com/,日本最初の大規模ニュータウン・千里から、ニュータウン・万博・まちづくりについて考える。
大阪府,生野区ドットコム,https://dch-osaka.com/ikunoku/,ママだからこそできるまちづくり
大阪府,イバナビ.com（旧・茨navi）,https://iba-navi.com/,茨木市の新鮮でリアルな情報をお伝えします
大阪府,We love 大阪,https://we-love-osaka.jp/,大阪の情報サイト
大阪府,うまいde池田,https://www.ikedashi-kanko.jp/,歴史と未来が織りなす街
大阪府,梅田の北っかわ！Ver.2.0,https://naka2.life/,地域がつながると町はきっと楽しくなる
大阪府,エキスポシティを徹底取材するブログ！,https://osaka1shop2channel.jp/,万博公園記念エリアの情報サイト
大阪府,大阪北河内じゃーなる,https://osakakitakawachi-journal.com/,今日の北川内をお伝えする、ほんわか情報サイト
大阪府,交野タイムズ,http://www.katano-times.com/,「こうのじゃないよ！かたのだよ！」大阪府交野市のローカル情報がめっちゃある！
大阪府,堺でしょ,https://sakaidesho.com/,堺市の子育て・お出かけ・お得マネー情報サイト
大阪府,高槻スクランブル,https://takatsuki-scramble.com/,高槻市のいろいろに迫る、暇つぶし情報サイト
大阪府,福島区ドットコム,https://dch-osaka.com/fukushimaku/,福島区がもっと好きになる！
大阪府,北摂てくてく,https://hokusetsu-tekuteku.com/,子供と遊ぶ、食べる、体験する
大阪府,ぼちぼち,https://bochi2.net/,この街で暮らす、働く、遊ぶ人のための話題とコミュニティを提案する大阪ローカルメディア
大阪府,ポンポンさやポン,https://sayapon.com/,「狭山池の毎日がわかる」世界で一つのウェブサイト
大阪府,守口クラブ,https://moriguchi.club/,守口市の地域情報をふわっとお届けします
大阪府,んなあほな,https://kamigatarakugo.jp/nnaahona/,噺家の姿をご覧いただき、一層落語の世界に興味をお持ちいただければ幸いです
兵庫県,明石じゃーなる,https://akashi-journal.com/,明石のゆるふわローカル地域情報サイト
兵庫県,明石たうんず,https://akashitowns.com/,明石市のニッチな情報をお届けします
兵庫県,尼崎旅～あまたび～,https://ama-tabi.com/,尼崎氏の今を発信する情報サイト
兵庫県,淡路島に移住してから,https://www.awajishima-base.jp/,淡路島の観光・グルメ情報や日々の暮らしを発信中
兵庫県,ITAMI ECHO,https://news.gotouti.jp/itami-echo/,伊丹の情報を発信するローカルメディア
兵庫県,いながわベース,https://inagawabase.com/,猪名川町の情報満載オウンドメディア
兵庫県,川西ジャーナル,https://kawanishi-journal.themedia.jp/,かわにしの「今」を伝えたい
兵庫県,KOBE Total Press,http://www.kobetotalpress.jp/, 神戸の『いいね』と思える情報を随時配信しています
兵庫県,三田の梅さん,https://sandanoumesan.com/,三田市の「おいしい、楽しい、嬉しい」がここにあります。
兵庫県,さんだ日和,http://www.sandabiyori.com/,三田がもっと楽しくなるウェブメディア
兵庫県,島ノオト,https://shima-note.com/,淡路島の声が聞こえるwebマガジン
兵庫県,てくてくひめじ,https://tekuteku-himeji.com/,ひめじとはりまのローカルな読み物サイト
兵庫県,西宮流,https://nishinomiya-style.jp/,西宮にとことんこだわる情報サイト
兵庫県,まいどなニュース,https://maidonanews.jp/,関西発、読んで納得の情報を発信します！
奈良県,奈良に住んでみました,http://small-life.com/,奈良の「重箱の隅」をつつくブログです。
奈良県,ならぷら,http://nara-pla.com/,奈良の地元ネタを毎日更新
奈良県,はぐnara,https://www.hug-nara.jp/,奈良を元気に！人・地域・企業をつなげる　はぐnara
奈良県,LOCAL LIFE JOURNAL,http://locallifejournal.jp/,奈良・奥大和の兆しを伝える
和歌山県,きい散歩,https://kiisanpo.com/,紀南地域のグルメ・観光・遊び等情報をお届けします
和歌山県,ロカル和歌山,https://rokaru.jp/,すぐわかる「まとめ」形式で和歌山の情報を発信中
和歌山県,wakayama.global,http://wakayama.global/,和歌山県を全国・世界へ発信するウェブメディア
島根県,うんせきブログ,https://unseki.co.jp/blog/,松江・出雲周辺の新店オープン情報や島根ローカルネタをお伝えします
島根県,しまね縁タメ,https://wakuwaku-keigo.com/shimane/,「人と島根を結ぶ」地域ローカルメディア
島根県,JIMOHACK島根県版,https://jimohack.shimane.jp/,島根の観光・暮らし・グルメ情報WEBマガジン
